{"article_id":"4e4099a7fa69b72a4c5356119477dde3a5e4666bee77db88c6428e65aed9f750","candidate_digest":"3fd8b2e659ceb1c9cf9ca7479b0d0ee06fc0df5f7f84fca8d13ac17468d09ac7","canonical_url":"https://example.org/articles/climate-risk","categories":["financial_risk"],"categories_basis":"upstream_classification","display_pillar":"A","origins":[{"discovered_at":"2026-09-05T12:00:00Z","input_artifact":{"artifact_id":"input.json","sha256":"aaaaaaaaaaaaaaaaaaaaaaaaaaaaaaaaaaaaaaaaaaaaaaaaaaaaaaaaaaaaaaaa"},"original_snippet":null,"original_summary":null,"original_title":"Climate risk guidance","pillar":"A","row":"/articles/0/items/0","snippet_basis":null,"source":"Example Org","summary_basis":null,"title_basis":"upstream_artifact","url":"https://example.org/articles/climate-risk"}],"schema_version":"url-first-article-candidate.v1","summary":null,"summary_basis":null,"title":null,"title_basis":null,"url":"https://example.org/articles/climate-risk"}
