{"article_id":"4e4099a7fa69b72a4c5356119477dde3a5e4666bee77db88c6428e65aed9f750","candidate_digest":"5f0fe9e1dc86c4461d27f2f5a47a53c7d0e73100d5e8b6deecc306a3931a7187","canonical_url":"https://example.org/articles/climate-risk","categories":["financial_risk"],"categories_basis":"upstream_classification","display_pillar":"A","origins":[{"discovered_at":"2026-09-05T12:00:00Z","input_artifact":{"artifact_id":"input.json","sha256":"aaaaaaaaaaaaaaaaaaaaaaaaaaaaaaaaaaaaaaaaaaaaaaaaaaaaaaaaaaaaaaaa"},"original_snippet":null,"original_summary":null,"original_title":"Climate risk guidance","pillar":"A","row":"/articles/0/items/0","snippet_basis":null,"source":"Example Org","summary_basis":null,"title_basis":"upstream_artifact","url":"https://example.org/articles/climate-risk"},{"discovered_at":"2026-09-05T12:00:00Z","input_artifact":{"artifact_id":"input.json","sha256":"aaaaaaaaaaaaaaaaaaaaaaaaaaaaaaaaaaaaaaaaaaaaaaaaaaaaaaaaaaaaaaaa"},"original_snippet":null,"original_summary":"Search evidence about insurer climate risk.","original_title":"Climate risk guidance","pillar":"B","row":"/0","snippet_basis":null,"source":"web","summary_basis":"search_result","title_basis":"search_result","url":"https://example.org/articles/climate-risk"}],"schema_version":"url-first-article-candidate.v1","summary":"Search evidence about insurer climate risk.","summary_basis":"search_result","title":"Climate risk guidance","title_basis":"search_result","url":"https://example.org/articles/climate-risk"}
