{"article_id":"3fac14da413e1a979e6dd00a815cb1948ece0b1f218b708aa9a6890dea63d50e","candidate_digest":"ca0c8a3e01781419c7e95a56aa15e28f41729f5c877c872037fa833058671ab6","canonical_url":"https://example.org/report?edition=2026&scenario=stress","categories":null,"categories_basis":null,"display_pillar":"B","origins":[{"discovered_at":"2026-09-05T12:00:00Z","input_artifact":{"artifact_id":"input.json","sha256":"aaaaaaaaaaaaaaaaaaaaaaaaaaaaaaaaaaaaaaaaaaaaaaaaaaaaaaaaaaaaaaaa"},"original_snippet":null,"original_summary":null,"original_title":null,"pillar":"B","row":"/2","snippet_basis":null,"source":"web","summary_basis":null,"title_basis":null,"url":"https://example.org/report?edition=2026&scenario=stress&utm_source=mail#findings"}],"schema_version":"url-first-article-candidate.v1","summary":null,"summary_basis":null,"title":null,"title_basis":null,"url":"https://example.org/report?edition=2026&scenario=stress&utm_source=mail#findings"}
