{"article_id":"14232d0373966775915fddbf9595899904fa9935ca81fd63e8f0ef9e2db8955f","candidate_digest":"9d87cdd2d9513ff39f8c4deb5be74861acaf55895076426cfa5c463c16f152c8","canonical_url":"https://example.org/url-only","categories":null,"categories_basis":null,"display_pillar":"B","origins":[{"discovered_at":"2026-09-05T12:00:00Z","input_artifact":{"artifact_id":"input.json","sha256":"aaaaaaaaaaaaaaaaaaaaaaaaaaaaaaaaaaaaaaaaaaaaaaaaaaaaaaaaaaaaaaaa"},"original_snippet":null,"original_summary":null,"original_title":null,"pillar":"B","row":"/1","snippet_basis":null,"source":"web","summary_basis":null,"title_basis":null,"url":"https://example.org/url-only"}],"schema_version":"url-first-article-candidate.v1","summary":null,"summary_basis":null,"title":null,"title_basis":null,"url":"https://example.org/url-only"}
