{"article_id":"4e4099a7fa69b72a4c5356119477dde3a5e4666bee77db88c6428e65aed9f750","candidate_digest":"9e0f397f9123e46cce1245a8a8b8b397eab39c912e22f3a7318105ad22779896","canonical_url":"https://example.org/articles/climate-risk","categories":null,"categories_basis":null,"display_pillar":"B","origins":[{"discovered_at":"2026-09-05T12:00:00Z","input_artifact":{"artifact_id":"input.json","sha256":"aaaaaaaaaaaaaaaaaaaaaaaaaaaaaaaaaaaaaaaaaaaaaaaaaaaaaaaaaaaaaaaa"},"original_snippet":null,"original_summary":"Search evidence about insurer climate risk.","original_title":"Climate risk guidance","pillar":"B","row":"/0","snippet_basis":null,"source":"web","summary_basis":"search_result","title_basis":"search_result","url":"https://example.org/articles/climate-risk"}],"schema_version":"url-first-article-candidate.v1","summary":"Search evidence about insurer climate risk.","summary_basis":"search_result","title":"Climate risk guidance","title_basis":"search_result","url":"https://example.org/articles/climate-risk"}
